Title,Year,Type,Journal Name,Article URL,Researcher Name,Profile URL,Job Title
Rethinking the Measurement of Pay Disparity and Its Effect on Firm Outcomes,2021,Conferences,,,Doowon Lee,https://sydney.edu.au/business/about/our-people/academic-staff/doowon.lee.html,Associate Professor
Executive Pay Disparity and Firm Operational Efficiency,2020,Conferences,,,Doowon Lee,https://sydney.edu.au/business/about/our-people/academic-staff/doowon.lee.html,Associate Professor
Remuneration Committee Characteristics and CEO Compensation,2020,Conferences,,,Doowon Lee,https://sydney.edu.au/business/about/our-people/academic-staff/doowon.lee.html,Associate Professor
Institutional Investors and Duration of Executive Compensation,2016,Conferences,,,Doowon Lee,https://sydney.edu.au/business/about/our-people/academic-staff/doowon.lee.html,Associate Professor
The Relationship Between Corporate Governance and Firm Enterprise Risk Management Practice,2015,Conferences,,,Doowon Lee,https://sydney.edu.au/business/about/our-people/academic-staff/doowon.lee.html,Associate Professor
"Market structure of cryptocurrencies. In S. Corbet, A. Urquhart, L. Yarovaya (Eds.)",2020,Book Chapters,,http://dx.doi.org/10.1515/9783110660807-006,Jiri Svec,https://sydney.edu.au/business/about/our-people/academic-staff/jiri.svec.html,Associate Professor
Evaluating the Performance of M&A,2014,Book Chapters,,,Jiri Svec,https://sydney.edu.au/business/about/our-people/academic-staff/jiri.svec.html,Associate Professor
"Locked in, levered up: Risk, return, and ruin in DeFi lending",2025,Journals,The British Accounting Review,http://dx.doi.org/10.1016/j.bar.2025.101691,Jiri Svec,https://sydney.edu.au/business/about/our-people/academic-staff/jiri.svec.html,Associate Professor
Revisiting the crisis: An empirical analysis of the NEM suspension,2025,Journals,Energy Economics,http://dx.doi.org/10.1016/j.eneco.2024.107983,Jiri Svec,https://sydney.edu.au/business/about/our-people/academic-staff/jiri.svec.html,Associate Professor
Crisis Capital: Private Placements During COVID-19,2024,Journals,Abacus,http://dx.doi.org/10.1111/abac.12309,Jiri Svec,https://sydney.edu.au/business/about/our-people/academic-staff/jiri.svec.html,Associate Professor
Option implied dividends and the market risk premium,2024,Journals,International Review of Economics and Finance,http://dx.doi.org/10.1016/j.iref.2024.103675,Jiri Svec,https://sydney.edu.au/business/about/our-people/academic-staff/jiri.svec.html,Associate Professor
The market risk premium in Australia: Forward-looking evidence from the options market,2024,Journals,Accounting and Finance,http://dx.doi.org/10.1111/acfi.13288,Jiri Svec,https://sydney.edu.au/business/about/our-people/academic-staff/jiri.svec.html,Associate Professor
Not so fast: Identifying and remediating slow and imprecise cryptocurrency exchange data,2023,Journals,Finance Research Letters,http://dx.doi.org/10.1016/j.frl.2022.103401,Jiri Svec,https://sydney.edu.au/business/about/our-people/academic-staff/jiri.svec.html,Associate Professor
When Bigger Is Better: The Impact of a Tiny Tick Size on Undercutting Behavior,2023,Journals,Journal of Financial and Quantitative Analysis,http://dx.doi.org/10.1017/S0022109022001077,Jiri Svec,https://sydney.edu.au/business/about/our-people/academic-staff/jiri.svec.html,Associate Professor
Can Bitcoin be Trusted? Quantifying the economic value of blockchain transactions,2022,Journals,"Journal of International Financial Markets, Institutions and Money",http://dx.doi.org/10.1016/j.intfin.2022.101577,Jiri Svec,https://sydney.edu.au/business/about/our-people/academic-staff/jiri.svec.html,Associate Professor
What is the expected return on Bitcoin? Extracting the term structure of returns from options prices,2022,Journals,Economics Letters,http://dx.doi.org/10.1016/j.econlet.2021.110196,Jiri Svec,https://sydney.edu.au/business/about/our-people/academic-staff/jiri.svec.html,Associate Professor
Decentralized exchanges: The “wild west” of cryptocurrency trading,2021,Journals,International Review of Financial Analysis,http://dx.doi.org/10.1016/j.irfa.2021.101845,Jiri Svec,https://sydney.edu.au/business/about/our-people/academic-staff/jiri.svec.html,Associate Professor
The game changer: Regulatory reform and multiple credit ratings,2021,Journals,Journal of Banking & Finance,http://dx.doi.org/10.1016/j.jbankfin.2021.106279,Jiri Svec,https://sydney.edu.au/business/about/our-people/academic-staff/jiri.svec.html,Associate Professor
How investible is Bitcoin? Analyzing the liquidity and transaction costs of Bitcoin markets,2018,Journals,Economics Letters,http://dx.doi.org/10.1016/j.econlet.2018.07.032,Jiri Svec,https://sydney.edu.au/business/about/our-people/academic-staff/jiri.svec.html,Associate Professor
The rise before the close: Underwriter trading around SEOs,2018,Journals,Journal of Empirical Finance,http://dx.doi.org/10.1016/j.jempfin.2018.07.002,Jiri Svec,https://sydney.edu.au/business/about/our-people/academic-staff/jiri.svec.html,Associate Professor
Australian Bond Excess Returns: An Asset Allocation Perspective,2017,Journals,Australian Economic Papers,http://dx.doi.org/10.1111/1467-8454.12087,Jiri Svec,https://sydney.edu.au/business/about/our-people/academic-staff/jiri.svec.html,Associate Professor
Forecasting volatility with interacting multiple models,2017,Journals,Finance Research Letters,http://dx.doi.org/10.1016/j.frl.2016.10.005,Jiri Svec,https://sydney.edu.au/business/about/our-people/academic-staff/jiri.svec.html,Associate Professor
"Wealth transfer, signaling and leverage in M&A",2017,Journals,International Review of Financial Analysis,http://dx.doi.org/10.1016/j.irfa.2017.06.002,Jiri Svec,https://sydney.edu.au/business/about/our-people/academic-staff/jiri.svec.html,Associate Professor
Forecasting the Government Bond Term Structure in Australia,2016,Journals,Australian Economic Papers,http://dx.doi.org/10.1111/1467-8454.12071,Jiri Svec,https://sydney.edu.au/business/about/our-people/academic-staff/jiri.svec.html,Associate Professor
Impact of Financial Crisis on the Profitability of Capital Structure Arbitrage in Australia,2016,Journals,International Journal of Banking and Finance,,Jiri Svec,https://sydney.edu.au/business/about/our-people/academic-staff/jiri.svec.html,Associate Professor
Underwritten Dividend Reinvestment Plans and Conflicts of Interest,2016,Journals,Journal of Business Finance and Accounting,http://dx.doi.org/10.1111/jbfa.12226,Jiri Svec,https://sydney.edu.au/business/about/our-people/academic-staff/jiri.svec.html,Associate Professor
The effects of fiscal opacity on sovereign credit spreads,2015,Journals,Emerging Markets Review,http://dx.doi.org/10.1016/j.ememar.2015.05.001,Jiri Svec,https://sydney.edu.au/business/about/our-people/academic-staff/jiri.svec.html,Associate Professor
Reporting Bias in Incomplete Information Model,2014,Journals,Economics Letters,http://dx.doi.org/10.1016/j.econlet.2014.01.021,Jiri Svec,https://sydney.edu.au/business/about/our-people/academic-staff/jiri.svec.html,Associate Professor
The Information Content of Ratings: An Analysis of Australian Credit Default Swap Spreads,2014,Journals,Abacus,http://dx.doi.org/10.1111/abac.12022,Jiri Svec,https://sydney.edu.au/business/about/our-people/academic-staff/jiri.svec.html,Associate Professor
The Role of Equity Analysts in the Pricing of Australian CDS Spreads During the Financial Crisis,2012,Journals,JASSA,http://dx.doi.org/10.3316/informit.136395905624900,Jiri Svec,https://sydney.edu.au/business/about/our-people/academic-staff/jiri.svec.html,Associate Professor
"Systematic Risk, CDS Spread and Market Integration: An Empirical Investigation",2010,Journals,JASSA,http://dx.doi.org/10.3316/ielapa.600634810122097,Jiri Svec,https://sydney.edu.au/business/about/our-people/academic-staff/jiri.svec.html,Associate Professor
Modelling and forecasting temperature based weather derivatives,2007,Journals,Global Finance Journal,http://dx.doi.org/10.1016/j.gfj.2006.04.006,Jiri Svec,https://sydney.edu.au/business/about/our-people/academic-staff/jiri.svec.html,Associate Professor
"Accounting information, life cycle and debt markets",2018,Conferences,,,Jiri Svec,https://sydney.edu.au/business/about/our-people/academic-staff/jiri.svec.html,Associate Professor
Do firms adjust their acquisition strategies and payment options in response to changes in financial reporting incentives?,2018,Conferences,,,Jiri Svec,https://sydney.edu.au/business/about/our-people/academic-staff/jiri.svec.html,Associate Professor
Identifying Wealth Transfer in M&A Using Credit Default Swaps,2016,Conferences,,,Jiri Svec,https://sydney.edu.au/business/about/our-people/academic-staff/jiri.svec.html,Associate Professor
Identifying Wealth Transfer in M&A Using Credit Default Swaps,2016,Conferences,,,Jiri Svec,https://sydney.edu.au/business/about/our-people/academic-staff/jiri.svec.html,Associate Professor
Diagnostic testing for earnings simulation engines in the Australian electricity market,2009,Report,,,Jiri Svec,https://sydney.edu.au/business/about/our-people/academic-staff/jiri.svec.html,Associate Professor
Ethnic green culture in leadership and corporate green investment: Evidence from China,2025,Journals,Global Finance Journal,http://dx.doi.org/10.1016/j.gfj.2025.101133,Wei Cui,https://sydney.edu.au/business/about/our-people/academic-staff/wei.cui.html,Lecturer
Funds of hedge funds: Are they really the high society for little guys?,2020,Journals,International Review of Economics and Finance,http://dx.doi.org/10.1016/j.iref.2020.02.004,Wei Cui,https://sydney.edu.au/business/about/our-people/academic-staff/wei.cui.html,Lecturer
Trapped in diversification - another look at the risk of fund of hedge funds,2019,Journals,European Journal of Finance,http://dx.doi.org/10.1080/1351847X.2019.1571524,Wei Cui,https://sydney.edu.au/business/about/our-people/academic-staff/wei.cui.html,Lecturer
Money and imperfectly competitive credit,2025,Journals,Journal of Economic Theory,http://dx.doi.org/10.1016/j.jet.2025.106050,Guangqian Pan,https://sydney.edu.au/business/about/our-people/academic-staff/guangqian.pan.html,Lecturer
The Shadow Cost of Collateral,2025,Journals,The Review of Financial Studies,http://dx.doi.org/10.1093/rfs/hhae073,Guangqian Pan,https://sydney.edu.au/business/about/our-people/academic-staff/guangqian.pan.html,Lecturer
"Geographic diversification, climate risk, and bank lending: Evidence from farm loans",2025,Journals,Journal of Financial Intermediation,http://dx.doi.org/10.1016/j.jfi.2025.101152,Mandeep Singh,https://sydney.edu.au/business/about/our-people/academic-staff/mandeep.singh.html,Lecturer
Investors reward countries for participating in climate agreements,2024,Journals,Nature Communications,http://dx.doi.org/10.1038/s41467-024-53012-y,Mandeep Singh,https://sydney.edu.au/business/about/our-people/academic-staff/mandeep.singh.html,Lecturer
Experimental Research on Retirement Decision-Making: Evidence from Replications,2023,Journals,Journal of Banking & Finance,http://dx.doi.org/10.1016/j.jbankfin.2023.106851,Andre Lot,https://sydney.edu.au/business/about/our-people/academic-staff/andre.lot.html,
Mergers and Acquisitions: Long-Run Performance and Success Factors,2020,Book Chapters,,http://dx.doi.org/10.1093/acrefore/9780190625979.013.608,Cara Vansteenkiste,https://sydney.edu.au/business/about/our-people/academic-staff/cara.vansteenkiste.html,Fellow
"Public-To-Private Leveraged Buyouts. In M. Wright, K. Amess, N. Bacon, D. Siegel (Eds.)",2019,Book Chapters,,http://dx.doi.org/10.4324/9781315230597-7,Cara Vansteenkiste,https://sydney.edu.au/business/about/our-people/academic-staff/cara.vansteenkiste.html,Fellow
"Disaster Relief, Inc.: When Is Corporate Philanthropy Good or Bad for Shareholders?",2025,Journals,Review of Finance,http://dx.doi.org/10.1093/rof/rfaf007,Cara Vansteenkiste,https://sydney.edu.au/business/about/our-people/academic-staff/cara.vansteenkiste.html,Fellow
Cross-border acquisitions and employment policies,2020,Journals,Journal of Corporate Finance,http://dx.doi.org/10.1016/j.jcorpfin.2020.101575,Cara Vansteenkiste,https://sydney.edu.au/business/about/our-people/academic-staff/cara.vansteenkiste.html,Fellow
Elective stock and scrip dividends,2020,Journals,Journal of Corporate Finance,http://dx.doi.org/10.1016/j.jcorpfin.2020.101660,Cara Vansteenkiste,https://sydney.edu.au/business/about/our-people/academic-staff/cara.vansteenkiste.html,Fellow
Failure and success in mergers and acquisitions,2019,Journals,Journal of Corporate Finance,http://dx.doi.org/10.1016/j.jcorpfin.2019.07.010,Cara Vansteenkiste,https://sydney.edu.au/business/about/our-people/academic-staff/cara.vansteenkiste.html,Fellow
"Creditor rights, claims enforcement, and bond performance in mergers and acquisitions",2017,Journals,Journal of International Business Studies,http://dx.doi.org/10.1057/s41267-016-0031-2,Cara Vansteenkiste,https://sydney.edu.au/business/about/our-people/academic-staff/cara.vansteenkiste.html,Fellow
Leveraged Buyouts: Motives and Sources of Value,2017,Journals,Critical Finance Review,http://dx.doi.org/10.1561/109.00000017,Cara Vansteenkiste,https://sydney.edu.au/business/about/our-people/academic-staff/cara.vansteenkiste.html,Fellow
"Trade Execution, Arbitrage and Dealing in Australia",2008,Books,,,Reuben Segara,https://sydney.edu.au/business/about/our-people/academic-staff/reuben.segara.html,Senior Lecturer
Does broker anonymity hide informed traders? In J. Jay Choi and Heibatollah Sami (Eds.),2012,Book Chapters,,http://dx.doi.org/10.1108/S1569-3767(2012)0000013013,Reuben Segara,https://sydney.edu.au/business/about/our-people/academic-staff/reuben.segara.html,Senior Lecturer
Do Carbon Assurance Providers Play a Strategic Role in Moderating the Relationship Between Carbon Emissions and Firms’ Cost of Equity?,2024,Journals,Abacus,http://dx.doi.org/10.1111/abac.12348,Reuben Segara,https://sydney.edu.au/business/about/our-people/academic-staff/reuben.segara.html,Senior Lecturer
Voluntary carbon assurance and the cost of equity capital: International evidence,2024,Journals,Australian Journal of Management,http://dx.doi.org/10.1177/03128962241251498,Reuben Segara,https://sydney.edu.au/business/about/our-people/academic-staff/reuben.segara.html,Senior Lecturer
To Herd or Not to Herd: Do Intangible Assets Affect the Behavior of Financial Analyst Recommendations?,2023,Journals,Journal of Behavioral Finance,http://dx.doi.org/10.1080/15427560.2021.1949596,Reuben Segara,https://sydney.edu.au/business/about/our-people/academic-staff/reuben.segara.html,Senior Lecturer
"Firm, institutional and short sellers’ trading behavior around share repurchases",2022,Journals,Managerial Finance,http://dx.doi.org/10.1108/MF-05-2021-0219,Reuben Segara,https://sydney.edu.au/business/about/our-people/academic-staff/reuben.segara.html,Senior Lecturer
Foreign investors' trading behaviors around merger and acquisition announcements: Evidence from Korea,2020,Journals,Finance Research Letters,http://dx.doi.org/10.1016/j.frl.2019.101375,Reuben Segara,https://sydney.edu.au/business/about/our-people/academic-staff/reuben.segara.html,Senior Lecturer
Analyst Tipping: Evidence on Finnish Stocks,2019,Journals,International Review of Financial Analysis,http://dx.doi.org/10.1016/j.irfa.2019.05.001,Reuben Segara,https://sydney.edu.au/business/about/our-people/academic-staff/reuben.segara.html,Senior Lecturer
Stock Price Movements and Trading Behaviors around Merger and Acquisition Announcements: Evidence from the Korean Stock Market,2019,Journals,International Journal of Managerial Finance,http://dx.doi.org/10.1108/IJMF-07-2018-0204,Reuben Segara,https://sydney.edu.au/business/about/our-people/academic-staff/reuben.segara.html,Senior Lecturer
Testing for Price Bubbles in Australian Listed Equities and A-REIT Markets,2019,Journals,AJAF - The Australasian Journal of Applied Finance,,Reuben Segara,https://sydney.edu.au/business/about/our-people/academic-staff/reuben.segara.html,Senior Lecturer
The bid-ask spread of bank-issued options: a quantile regression analysis,2013,Journals,Quantitative Finance,http://dx.doi.org/10.1080/14697688.2012.728006,Reuben Segara,https://sydney.edu.au/business/about/our-people/academic-staff/reuben.segara.html,Senior Lecturer
Performance of Active Extension Strategies: Evidence from the Australian Equities Market,2012,Journals,Australasian Accounting Business and Finance Journal,,Reuben Segara,https://sydney.edu.au/business/about/our-people/academic-staff/reuben.segara.html,Senior Lecturer
The impact of naked short selling on the securities lending and equity market,2012,Journals,Journal of Financial Markets,http://dx.doi.org/10.1016/j.finmar.2011.07.001,Reuben Segara,https://sydney.edu.au/business/about/our-people/academic-staff/reuben.segara.html,Senior Lecturer
The Impact of Trading Halts on Liquidity and Price Volatility: Evidence from the Australian Stock Exchange,2011,Journals,Pacific-Basin Finance Journal,http://dx.doi.org/10.1016/j.pacfin.2010.12.003,Reuben Segara,https://sydney.edu.au/business/about/our-people/academic-staff/reuben.segara.html,Senior Lecturer
Supporting the reflective practice of tutors: what do tutors reflect on?,2010,Journals,Teaching in Higher Education,http://dx.doi.org/10.1080/13562510903488139,Reuben Segara,https://sydney.edu.au/business/about/our-people/academic-staff/reuben.segara.html,Senior Lecturer
The Impact of Trade Characteristics on Stock Return Volatility: Evidence from he Australian Stock Exchange,2009,Journals,Asia-Pacific Journal of Financial Studies,http://dx.doi.org/10.1111/j.2041-6156.2009.tb00011.x,Reuben Segara,https://sydney.edu.au/business/about/our-people/academic-staff/reuben.segara.html,Senior Lecturer
Are third-party equity warrants redundant?,2008,Journals,Journal of Financial Transformation,,Reuben Segara,https://sydney.edu.au/business/about/our-people/academic-staff/reuben.segara.html,Senior Lecturer
The Scholarly Output of Universities and Academics in the Asia-Pacific Region Who Publish in Major Finance Journals: 2000-2007,2008,Journals,Australasian Accounting Business and Finance Journal,,Reuben Segara,https://sydney.edu.au/business/about/our-people/academic-staff/reuben.segara.html,Senior Lecturer
Intraday trading patterns in the equity warrants and equity options markets: Australian evidence,2007,Journals,Australasian Accounting Business and Finance Journal,,Reuben Segara,https://sydney.edu.au/business/about/our-people/academic-staff/reuben.segara.html,Senior Lecturer
Market Microstructure Effects on Volatility at the TAIFEX,2007,Journals,The Journal of Futures Markets,http://dx.doi.org/10.1002/fut.20289,Reuben Segara,https://sydney.edu.au/business/about/our-people/academic-staff/reuben.segara.html,Senior Lecturer
The Performance of Exchange-Traded Funds in Australia,2006,Journals,Journal of Investment Strategy,,Reuben Segara,https://sydney.edu.au/business/about/our-people/academic-staff/reuben.segara.html,Senior Lecturer
Impact of warrant introductions on the behaviour of underlying stocks: Australian evidence,2005,Journals,Accounting and Finance,http://dx.doi.org/10.1111/j.1467-629x.2004.00126.x,Reuben Segara,https://sydney.edu.au/business/about/our-people/academic-staff/reuben.segara.html,Senior Lecturer
Intangible Assets and Financial Analyst Herding Behaviour,2019,Conferences,,,Reuben Segara,https://sydney.edu.au/business/about/our-people/academic-staff/reuben.segara.html,Senior Lecturer
Analyst Tipping: Evidence on Finnish Stocks,2018,Conferences,,,Reuben Segara,https://sydney.edu.au/business/about/our-people/academic-staff/reuben.segara.html,Senior Lecturer
Analyst Tipping: Evidence on Finnish Stocks,2018,Conferences,,,Reuben Segara,https://sydney.edu.au/business/about/our-people/academic-staff/reuben.segara.html,Senior Lecturer
Analyst Tipping: Evidence on Finnish Stocks,2018,Conferences,,,Reuben Segara,https://sydney.edu.au/business/about/our-people/academic-staff/reuben.segara.html,Senior Lecturer
Analyst Tipping: Evidence on Finnish Stocks,2018,Conferences,,,Reuben Segara,https://sydney.edu.au/business/about/our-people/academic-staff/reuben.segara.html,Senior Lecturer
Does Broker Anonymity Hide Informed Traders?,2009,Conferences,,,Reuben Segara,https://sydney.edu.au/business/about/our-people/academic-staff/reuben.segara.html,Senior Lecturer
Supporting the reflective practice of tutors: what do tutors reflect on?,2009,Conferences,,,Reuben Segara,https://sydney.edu.au/business/about/our-people/academic-staff/reuben.segara.html,Senior Lecturer
On-market or off-market? An analysis on the choice of trading venue for the Australian Stock Exchange,2008,Conferences,,,Reuben Segara,https://sydney.edu.au/business/about/our-people/academic-staff/reuben.segara.html,Senior Lecturer
Are warrants redundant? Spanning tests and price discovery,2005,Conferences,,,Reuben Segara,https://sydney.edu.au/business/about/our-people/academic-staff/reuben.segara.html,Senior Lecturer
Asset price bubbles in the Australian Market,2016,Research Reports,,,Reuben Segara,https://sydney.edu.au/business/about/our-people/academic-staff/reuben.segara.html,Senior Lecturer
Option implied dividends and the market risk premium,2024,Journals,International Review of Economics and Finance,http://dx.doi.org/10.1016/j.iref.2024.103675,Hamish Malloch,https://sydney.edu.au/business/about/our-people/academic-staff/hamish.malloch.html,Senior Lecturer
The market risk premium in Australia: Forward-looking evidence from the options market,2024,Journals,Accounting and Finance,http://dx.doi.org/10.1111/acfi.13288,Hamish Malloch,https://sydney.edu.au/business/about/our-people/academic-staff/hamish.malloch.html,Senior Lecturer
Estimation with Errors in Variables via the Characteristic Function,2023,Journals,Journal of Financial Econometrics,http://dx.doi.org/10.1093/jjfinec/nbab011,Hamish Malloch,https://sydney.edu.au/business/about/our-people/academic-staff/hamish.malloch.html,Senior Lecturer
Stock Valuation during the COVID-19 Pandemic: An Explanation using Option-based Discount Rates,2023,Journals,Journal of Banking & Finance,http://dx.doi.org/10.1016/j.jbankfin.2021.106386,Hamish Malloch,https://sydney.edu.au/business/about/our-people/academic-staff/hamish.malloch.html,Senior Lecturer
What is the expected return on Bitcoin? Extracting the term structure of returns from options prices,2022,Journals,Economics Letters,http://dx.doi.org/10.1016/j.econlet.2021.110196,Hamish Malloch,https://sydney.edu.au/business/about/our-people/academic-staff/hamish.malloch.html,Senior Lecturer
Quote-Based manipulation of illiquid securities,2021,Journals,Finance Research Letters,http://dx.doi.org/10.1016/j.frl.2020.101556,Hamish Malloch,https://sydney.edu.au/business/about/our-people/academic-staff/hamish.malloch.html,Senior Lecturer
The value of momentum to active managers and planned sponsors in Australia,2018,Journals,AJAF - The Australasian Journal of Applied Finance,https://www.finsia.com/docs/default-source/jassa-current-issue/ajaf-2018-issue-1/ajaf-2018-issue-1_article-1.pdf,Hamish Malloch,https://sydney.edu.au/business/about/our-people/academic-staff/hamish.malloch.html,Senior Lecturer
Decomposing the bias in time-series estimates of CAPM betas,2016,Journals,Applied Economics,http://dx.doi.org/10.1080/00036846.2016.1156233,Hamish Malloch,https://sydney.edu.au/business/about/our-people/academic-staff/hamish.malloch.html,Senior Lecturer
"CLA's, PLA's and a new method for pricing general passport options",2014,Journals,Quantitative Finance,http://dx.doi.org/10.1080/14697688.2014.882011,Hamish Malloch,https://sydney.edu.au/business/about/our-people/academic-staff/hamish.malloch.html,Senior Lecturer
"Debt Rollover Risk, Credit Default Swap Spread and Stock Returns: Evidence from the COVID-19 Crisis",2021,Journals,Journal of Financial Stability,http://dx.doi.org/10.1016/j.jfs.2021.100855,Miss Daisy Liu,https://sydney.edu.au/business/about/our-people/academic-staff/ya.liu.html,
"Institutional Change, Labor Mobility and Global Innovation: Evidence from the Inevitable Disclosure",2025,Conferences,,https://journals.aom.org/doi/10.5465/AMPROC.2025.16870poster,Miss Daisy Liu,https://sydney.edu.au/business/about/our-people/academic-staff/ya.liu.html,
Does geopolitical risk raise or lower corporate credit spreads?,2025,Journals,Economics Letters,http://dx.doi.org/10.1016/j.econlet.2025.112201,Yancheng Qiu,https://sydney.edu.au/business/about/our-people/academic-staff/yancheng.qiu.html,Lecturer
Monetary policy spillovers through debt currencies,2024,Journals,Economics Letters,http://dx.doi.org/10.1016/j.econlet.2024.111610,Yancheng Qiu,https://sydney.edu.au/business/about/our-people/academic-staff/yancheng.qiu.html,Lecturer
Corporate bond market reactions to quantitative easing during the COVID-19 pandemic,2021,Journals,Journal of Banking & Finance,http://dx.doi.org/10.1016/j.jbankfin.2021.106153,Yancheng Qiu,https://sydney.edu.au/business/about/our-people/academic-staff/yancheng.qiu.html,Lecturer
Security Analysts' Earnings Forecasts. In unknown (Eds.),2013,Book Chapters,,,Henry Leung,https://sydney.edu.au/business/about/our-people/academic-staff/henry.leung.html,Senior Lecturer
Navigating competitor networks: The influence of geographic density on corporate governance,2025,Journals,International Review of Economics and Finance,http://dx.doi.org/10.1016/j.iref.2025.104277,Henry Leung,https://sydney.edu.au/business/about/our-people/academic-staff/henry.leung.html,Senior Lecturer
The Effect of Social Media on Corporate Innovation: Evidence from Seeking Alpha Coverage,2025,Journals,Management Science,http://dx.doi.org/10.1287/mnsc.2023.00995,Henry Leung,https://sydney.edu.au/business/about/our-people/academic-staff/henry.leung.html,Senior Lecturer
