Title,Year,Type,Journal Name,Article URL,Researcher Name,Profile URL
Dialogical concept mapping of threshold concepts to validate assurance of learning,2012,Conferences,,,Sandra Van Der Laan,https://sydney.edu.au/business/about/our-people/academic-staff/sandra.vanderlaan.html
Exposing a gap - Using concept mapping in direct assessment for assurance of learning in an accounting knowledge space,2012,Conferences,,,Sandra Van Der Laan,https://sydney.edu.au/business/about/our-people/academic-staff/sandra.vanderlaan.html
Regulatory Influences on Group Composition: An Australian Perspective,2012,Conferences,,,Sandra Van Der Laan,https://sydney.edu.au/business/about/our-people/academic-staff/sandra.vanderlaan.html
The Metonymy of Asbestos: A Commentary on the changing meaning,2012,Conferences,,,Sandra Van Der Laan,https://sydney.edu.au/business/about/our-people/academic-staff/sandra.vanderlaan.html
The Rise and Fall of Asbestos: A tale of two companies,2012,Conferences,,,Sandra Van Der Laan,https://sydney.edu.au/business/about/our-people/academic-staff/sandra.vanderlaan.html
A Comparative Longitudinal Study of Narrative Disclosures of asbestos: James Hardie (Australia) & Turner & Newall (UK),2011,Conferences,,,Sandra Van Der Laan,https://sydney.edu.au/business/about/our-people/academic-staff/sandra.vanderlaan.html
Social Accounting: Asbestos in Australia,2011,Conferences,,,Sandra Van Der Laan,https://sydney.edu.au/business/about/our-people/academic-staff/sandra.vanderlaan.html
A Microhistory of a Regulatory Intervention: Creating Closed Groups,2010,Conferences,,,Sandra Van Der Laan,https://sydney.edu.au/business/about/our-people/academic-staff/sandra.vanderlaan.html
"Accountability, Asbestos and Indigenous Rights: The Case of Baryulgil",2010,Conferences,,,Sandra Van Der Laan,https://sydney.edu.au/business/about/our-people/academic-staff/sandra.vanderlaan.html
Funding Asbestos Liabilities: An investigation of corporate and regulatory responses,2010,Conferences,,,Sandra Van Der Laan,https://sydney.edu.au/business/about/our-people/academic-staff/sandra.vanderlaan.html
James Hardie & The Final Funding Agreement,2010,Conferences,,,Sandra Van Der Laan,https://sydney.edu.au/business/about/our-people/academic-staff/sandra.vanderlaan.html
Recognising Contingent Liabilities; Long Tails and Accounting Frameworks,2010,Conferences,,,Sandra Van Der Laan,https://sydney.edu.au/business/about/our-people/academic-staff/sandra.vanderlaan.html
The Auditor's Paradox: Auditing Litigation Liabilities,2010,Conferences,,,Sandra Van Der Laan,https://sydney.edu.au/business/about/our-people/academic-staff/sandra.vanderlaan.html
The Baryulgi Mine: Asbestos and Aboriginality,2010,Conferences,,,Sandra Van Der Laan,https://sydney.edu.au/business/about/our-people/academic-staff/sandra.vanderlaan.html
The History of a Regulatory Intervention: Creating closed groups,2010,Conferences,,,Sandra Van Der Laan,https://sydney.edu.au/business/about/our-people/academic-staff/sandra.vanderlaan.html
Contesting the Benefits of Executing a Deed of Cross Guarantee,2009,Conferences,,,Sandra Van Der Laan,https://sydney.edu.au/business/about/our-people/academic-staff/sandra.vanderlaan.html
Concept Mapping as a Means of Navigating Personal Learning,2007,Conferences,,,Sandra Van Der Laan,https://sydney.edu.au/business/about/our-people/academic-staff/sandra.vanderlaan.html
Embedded Concept Maps in Support of Meaningful Learning: A Learner-Centric Model,2007,Conferences,,,Sandra Van Der Laan,https://sydney.edu.au/business/about/our-people/academic-staff/sandra.vanderlaan.html
Exposing Organisational Rhetoric: The Case of James Hardie,2007,Conferences,,,Sandra Van Der Laan,https://sydney.edu.au/business/about/our-people/academic-staff/sandra.vanderlaan.html
"An Empirical Examination of the Market Returns, Financial Performance and Distress Risk Profiles of Entities Engaged in Sustainability Disclosure",2006,Conferences,,,Sandra Van Der Laan,https://sydney.edu.au/business/about/our-people/academic-staff/sandra.vanderlaan.html
Assessment to encourage meaningful learning in groups: Concept mapping,2006,Conferences,,,Sandra Van Der Laan,https://sydney.edu.au/business/about/our-people/academic-staff/sandra.vanderlaan.html
e-Learning - Organising the aftermath,2006,Conferences,,,Sandra Van Der Laan,https://sydney.edu.au/business/about/our-people/academic-staff/sandra.vanderlaan.html
Navigating the icebergs of online learning,2006,Conferences,,,Sandra Van Der Laan,https://sydney.edu.au/business/about/our-people/academic-staff/sandra.vanderlaan.html
Teaching and learning in large classes: Methods and tools to assess and promote meaningful learning,2006,Conferences,,,Sandra Van Der Laan,https://sydney.edu.au/business/about/our-people/academic-staff/sandra.vanderlaan.html
The Investment Performance of Ethical Funds in Australia,2006,Conferences,,,Sandra Van Der Laan,https://sydney.edu.au/business/about/our-people/academic-staff/sandra.vanderlaan.html
The Investment Performance of Ethical Funds in Australia,2006,Conferences,,,Sandra Van Der Laan,https://sydney.edu.au/business/about/our-people/academic-staff/sandra.vanderlaan.html
A Survey of Sustainability Reporting Practices of Australian Companies,2005,Conferences,,,Sandra Van Der Laan,https://sydney.edu.au/business/about/our-people/academic-staff/sandra.vanderlaan.html
Evaluation of a Student Assessment Technology Implementation,2005,Conferences,,,Sandra Van Der Laan,https://sydney.edu.au/business/about/our-people/academic-staff/sandra.vanderlaan.html
New teaching for new students in a new context: Pushing the boundaries in assessment,2005,Conferences,,,Sandra Van Der Laan,https://sydney.edu.au/business/about/our-people/academic-staff/sandra.vanderlaan.html
Prescription for Profit: Is the Pharmaceutical Industry Making a Killing?,2005,Conferences,,,Sandra Van Der Laan,https://sydney.edu.au/business/about/our-people/academic-staff/sandra.vanderlaan.html
The Role Of Theory In Explaining Motivation For Corporate Social Disclosures: Voluntary Vs 'Solicited' Disclosures,2004,Conferences,,,Sandra Van Der Laan,https://sydney.edu.au/business/about/our-people/academic-staff/sandra.vanderlaan.html
Ethical Investment: Australian Regulation for Greater Accountability for Products Offered by the Finance Industry,2003,Conferences,,,Sandra Van Der Laan,https://sydney.edu.au/business/about/our-people/academic-staff/sandra.vanderlaan.html
Social reporting by the Tobacco Industry: all smoke and no mirrors?,2003,Conferences,,,Sandra Van Der Laan,https://sydney.edu.au/business/about/our-people/academic-staff/sandra.vanderlaan.html
Hardie given far too much wriggle room,2009,Magazine / Newspaper Articles,,,Sandra Van Der Laan,https://sydney.edu.au/business/about/our-people/academic-staff/sandra.vanderlaan.html
Towards constructive alignment: Mapping the territory,2007,Report,,,Sandra Van Der Laan,https://sydney.edu.au/business/about/our-people/academic-staff/sandra.vanderlaan.html
Sustainability Reporting: Perspectives on Regulatory and Professional Initiatives across the Asia Pacific,2005,Report,,,Sandra Van Der Laan,https://sydney.edu.au/business/about/our-people/academic-staff/sandra.vanderlaan.html
"Sustainability Reporting: Practices, Performance and Potential",2005,Report,,,Sandra Van Der Laan,https://sydney.edu.au/business/about/our-people/academic-staff/sandra.vanderlaan.html
It's your funeral: An investigation of death care and the funeral industry in Australia,2017,Research Reports,,,Sandra Van Der Laan,https://sydney.edu.au/business/about/our-people/academic-staff/sandra.vanderlaan.html
"Stata enabling state-of-the-art research in accounting, business, and finance. In Enrique Pinzon (Eds.)",2015,Book Chapters,,,Demetris Christodoulou,https://sydney.edu.au/business/about/our-people/academic-staff/demetris.christodoulou.html
Moving averages of even spans and their end points,2025,Journals,Stata Journal,,Demetris Christodoulou,https://sydney.edu.au/business/about/our-people/academic-staff/demetris.christodoulou.html
Bridging the Gap between Stock Price and Bottom-Line Accounting Numbers,2024,Journals,Review of Accounting Studies,http://dx.doi.org/10.1007/s11142-022-09722-z,Demetris Christodoulou,https://sydney.edu.au/business/about/our-people/academic-staff/demetris.christodoulou.html
Lower disclosures from customers screened by financial advisors,2024,Journals,Journal of Risk and Insurance,http://dx.doi.org/10.1111/jori.12453,Demetris Christodoulou,https://sydney.edu.au/business/about/our-people/academic-staff/demetris.christodoulou.html
Counteracting dishonesty strategies: A field experiment in life insurance underwriting,2023,Journals,Journal of Behavioral Decision Making,http://dx.doi.org/10.1002/bdm.2302,Demetris Christodoulou,https://sydney.edu.au/business/about/our-people/academic-staff/demetris.christodoulou.html
The evolution of financial constraints,2022,Journals,European Financial Management,http://dx.doi.org/10.1111/eufm.12310,Demetris Christodoulou,https://sydney.edu.au/business/about/our-people/academic-staff/demetris.christodoulou.html
Asymmetric impact of earnings news on investor uncertainty,2020,Journals,Journal of Business Finance and Accounting,http://dx.doi.org/10.1111/jbfa.12428,Demetris Christodoulou,https://sydney.edu.au/business/about/our-people/academic-staff/demetris.christodoulou.html
Stata tip 137: Interpreting constraints on slopes of rank-deficient design matrices,2020,Journals,Stata Journal,http://dx.doi.org/10.1177/1536867X20931027,Demetris Christodoulou,https://sydney.edu.au/business/about/our-people/academic-staff/demetris.christodoulou.html
The adviser effect on insurance disclosures,2020,Journals,Applied Economics,http://dx.doi.org/10.1080/00036846.2019.1646883,Demetris Christodoulou,https://sydney.edu.au/business/about/our-people/academic-staff/demetris.christodoulou.html
The double entry structural constraint on the econometric estimation of accounting variables,2019,Journals,European Journal of Finance,http://dx.doi.org/10.1080/1351847X.2019.1667847,Demetris Christodoulou,https://sydney.edu.au/business/about/our-people/academic-staff/demetris.christodoulou.html
Inference-in-residuals as an Estimation Method for Earnings Management,2018,Journals,Abacus,http://dx.doi.org/10.1111/abac.12121,Demetris Christodoulou,https://sydney.edu.au/business/about/our-people/academic-staff/demetris.christodoulou.html
The accounting identity trap: identification under stock-and-flow rank deficiency,2018,Journals,Applied Economics,http://dx.doi.org/10.1080/00036846.2017.1363860,Demetris Christodoulou,https://sydney.edu.au/business/about/our-people/academic-staff/demetris.christodoulou.html
The productivity of Chinese patents: The role of business area and ownership type,2018,Journals,International Journal of Production Economics,http://dx.doi.org/10.1016/j.ijpe.2017.12.024,Demetris Christodoulou,https://sydney.edu.au/business/about/our-people/academic-staff/demetris.christodoulou.html
Heuristic criteria for selecting an optimal aspect ratio in a two-variable line plot,2017,Journals,Stata Journal,http://dx.doi.org/10.1177/1536867x1701700203,Demetris Christodoulou,https://sydney.edu.au/business/about/our-people/academic-staff/demetris.christodoulou.html
Regression clustering for panel data models with fixed effects,2017,Journals,Stata Journal,,Demetris Christodoulou,https://sydney.edu.au/business/about/our-people/academic-staff/demetris.christodoulou.html
A Structural Accounting Framework for Estimating the Expected Rate of Return on Equity,2016,Journals,Abacus,http://dx.doi.org/10.1111/abac.12073,Demetris Christodoulou,https://sydney.edu.au/business/about/our-people/academic-staff/demetris.christodoulou.html
"The Double Entry Constraint, Structural Modeling and Econometric Estimation",2014,Journals,Contemporary Accounting Research,http://dx.doi.org/10.1111/1911-3846.12038,Demetris Christodoulou,https://sydney.edu.au/business/about/our-people/academic-staff/demetris.christodoulou.html
Audit Fees and Deeds of Cross Guarantee: An Empirical Evaluation,2012,Journals,Abacus,http://dx.doi.org/10.1111/j.1467-6281.2012.00367.x,Demetris Christodoulou,https://sydney.edu.au/business/about/our-people/academic-staff/demetris.christodoulou.html
Legally-Recognised Group Structures: An Exploratory Analysis,2012,Journals,Australian Accounting Review,http://dx.doi.org/10.1111/j.1835-2561.2012.00170.x,Demetris Christodoulou,https://sydney.edu.au/business/about/our-people/academic-staff/demetris.christodoulou.html
Bounded Variation and the Asymmetric Distribution of Scaled Earnings,2009,Journals,Accounting and Business Research,http://dx.doi.org/10.1080/00014788.2009.9663372,Demetris Christodoulou,https://sydney.edu.au/business/about/our-people/academic-staff/demetris.christodoulou.html
Earnings Conservatism: Panel Data Evidence from the European Union and the United States,2006,Journals,Abacus,http://dx.doi.org/10.1111/j.1467-6281.2006.00205.x,Demetris Christodoulou,https://sydney.edu.au/business/about/our-people/academic-staff/demetris.christodoulou.html
Do advisors skew disclosures? - Journal of the Australian and New Zealand Institute of Insurance and Finance (ANZIIF),2020,Report,Do advisors skew disclosures? - Journal of the Australian and New Zealand Institute of Insurance and Finance (ANZIIF),,Demetris Christodoulou,https://sydney.edu.au/business/about/our-people/academic-staff/demetris.christodoulou.html
"Behavioural Finance Client and Consumer Behaviour: Engagement and Decision Making - Handbook for Financial Advisers, Sydney, Australia",2019,Report,,,Demetris Christodoulou,https://sydney.edu.au/business/about/our-people/academic-staff/demetris.christodoulou.html
"Assessing Strategic Readiness for Healthcare Analytics: System and Design Theory Implications. In Samir Chatterjee, Kaushik Dutta, Rangaraja P. Sundarraj (Eds.)",2018,Book Chapters,,http://dx.doi.org/10.1007/978-3-319-91800-6_8,Ravi Seethamraju,https://sydney.edu.au/business/about/our-people/academic-staff/ravi.seethamraju.html
"Enterprise Systems Software in the Business Curriculum: Aligning Curriculum with Industry Requirements. In Lowry, Glenn.R and Turner, Rodney.L (Eds.)",2007,Book Chapters,,,Ravi Seethamraju,https://sydney.edu.au/business/about/our-people/academic-staff/ravi.seethamraju.html
Sustainability reporting standards: challenges for data sourcing and information infrastructure,2025,Journals,Australian Journal of Management,,Ravi Seethamraju,https://sydney.edu.au/business/about/our-people/academic-staff/ravi.seethamraju.html
Blockchain: Exploring its Impact on the Business Models of Australian Accounting Firms,2024,Journals,Information Systems Frontiers,http://dx.doi.org/10.1007/s10796-024-10547-1,Ravi Seethamraju,https://sydney.edu.au/business/about/our-people/academic-staff/ravi.seethamraju.html
Adoption of artificial intelligence in auditing: An exploratory study,2023,Journals,Australian Journal of Management,http://dx.doi.org/10.1177/03128962221108440,Ravi Seethamraju,https://sydney.edu.au/business/about/our-people/academic-staff/ravi.seethamraju.html
Client use of blockchain technology: exploring its (potential) impact on financial statement audits of Australian accounting firms,2022,Journals,"Accounting, Auditing and Accountability Journal",http://dx.doi.org/10.1108/AAAJ-07-2020-4681,Ravi Seethamraju,https://sydney.edu.au/business/about/our-people/academic-staff/ravi.seethamraju.html
Exploring health-analytics adoption in indian private healthcare organizations: An institutional-theoretic perspective,2022,Journals,Information and Organization,http://dx.doi.org/10.1016/j.infoandorg.2022.100430,Ravi Seethamraju,https://sydney.edu.au/business/about/our-people/academic-staff/ravi.seethamraju.html
The impact of client use of blockchain technology on audit risk and audit approach - an exploratory study,2021,Journals,International Journal of Auditing,http://dx.doi.org/10.1111/ijau.12238,Ravi Seethamraju,https://sydney.edu.au/business/about/our-people/academic-staff/ravi.seethamraju.html
Intention to Use a Mobile-Based Information Technology Solution for Tuberculosis Treatment Monitoring - Applying a UTAUT Model,2018,Journals,Information Systems Frontiers,http://dx.doi.org/10.1007/s10796-017-9801-z,Ravi Seethamraju,https://sydney.edu.au/business/about/our-people/academic-staff/ravi.seethamraju.html
Adoption of Software as a Service (SaaS) Enterprise Resource Planning (ERP) Systems in Small and Medium Sized Enterprises (SMEs),2015,Journals,Information Systems Frontiers,http://dx.doi.org/10.1007/s10796-014-9506-5,Ravi Seethamraju,https://sydney.edu.au/business/about/our-people/academic-staff/ravi.seethamraju.html
Effectiveness of Using Online Discussion Forum for Case Study Analysis,2014,Journals,Education Research International,http://dx.doi.org/10.1155/2014/589860,Ravi Seethamraju,https://sydney.edu.au/business/about/our-people/academic-staff/ravi.seethamraju.html
Enterprise systems and demand chain management: a cross-sectional field study,2014,Journals,Information Technology and Management,http://dx.doi.org/10.1007/s10799-014-0178-0,Ravi Seethamraju,https://sydney.edu.au/business/about/our-people/academic-staff/ravi.seethamraju.html
Influence of ERP systems on business process agility,2013,Journals,IIMB Management Review,http://dx.doi.org/10.1016/j.iimb.2013.05.001,Ravi Seethamraju,https://sydney.edu.au/business/about/our-people/academic-staff/ravi.seethamraju.html
Business process management: a missing link in business education,2012,Journals,Business Process Management Journal,http://dx.doi.org/10.1108/14637151211232696,Ravi Seethamraju,https://sydney.edu.au/business/about/our-people/academic-staff/ravi.seethamraju.html
Enhancing Student Learning of Enterprise Integration and Business Process Orientation through an ERP Business Simulation Game,2011,Journals,Journal of Information Systems Education,,Ravi Seethamraju,https://sydney.edu.au/business/about/our-people/academic-staff/ravi.seethamraju.html
Influence of group formation choices on academic performance,2009,Journals,Assessment and Evaluation in Higher Education,http://dx.doi.org/10.1080/02602930801895679,Ravi Seethamraju,https://sydney.edu.au/business/about/our-people/academic-staff/ravi.seethamraju.html
Role of process knowledge in business process improvement methodology: a case study,2009,Journals,Business Process Management Journal,http://dx.doi.org/10.1108/14637150911003784,Ravi Seethamraju,https://sydney.edu.au/business/about/our-people/academic-staff/ravi.seethamraju.html
Role of Enterprise Systems in Achieving Supply Chain Integration,2008,Journals,International Journal of Business Insights and Transformation,,Ravi Seethamraju,https://sydney.edu.au/business/about/our-people/academic-staff/ravi.seethamraju.html
Enterprise Systems (ES) Software in Business School Curriculum - Evaluation of Design and Delivery,2007,Journals,Journal of Information Systems Education,,Ravi Seethamraju,https://sydney.edu.au/business/about/our-people/academic-staff/ravi.seethamraju.html
Impact of e-commerce on business process redesign and integration,2006,Journals,International Journal of Electronic Business,,Ravi Seethamraju,https://sydney.edu.au/business/about/our-people/academic-staff/ravi.seethamraju.html
Web Quality - A Study of User Perceptions,2006,Journals,IIMB Management Review,,Ravi Seethamraju,https://sydney.edu.au/business/about/our-people/academic-staff/ravi.seethamraju.html
Enterprise Resource Planning Systems - Implications for Managers and Management,2005,Journals,Australian Accounting Review,,Ravi Seethamraju,https://sydney.edu.au/business/about/our-people/academic-staff/ravi.seethamraju.html
Effectiveness Of A Post-Graduate Program In Enterprise Resource Incorporating Sap R/3,2004,Journals,Journal of Informatics Education and Research,,Ravi Seethamraju,https://sydney.edu.au/business/about/our-people/academic-staff/ravi.seethamraju.html
Knowledge management issues in the management of professional engineers,2001,Journals,Journal of Scientific and Industrial Research,,Ravi Seethamraju,https://sydney.edu.au/business/about/our-people/academic-staff/ravi.seethamraju.html
AI Use in Auditing - A Technology Dominance Perspective,2025,Conferences,,http://dx.doi.org/10.24251/HICSS.2025.660,Ravi Seethamraju,https://sydney.edu.au/business/about/our-people/academic-staff/ravi.seethamraju.html
Blockchain: Exploring its Impact on the Business Models of Australian Accounting Firms,2023,Conferences,,https://hdl.handle.net/10125/103103,Ravi Seethamraju,https://sydney.edu.au/business/about/our-people/academic-staff/ravi.seethamraju.html
Technology-enabled Active Learning (TEAL) - A Study of its Influence on Student Learning,2023,Conferences,,https://aisel.aisnet.org/acis2023/146/,Ravi Seethamraju,https://sydney.edu.au/business/about/our-people/academic-staff/ravi.seethamraju.html
Client use of blockchain technology: exploring its (potential) impact on financial statement audits of Australian accounting firms,2020,Conferences,,,Ravi Seethamraju,https://sydney.edu.au/business/about/our-people/academic-staff/ravi.seethamraju.html
Impact of Artificial Intelligence on Auditing - An Exploratory Study,2020,Conferences,,https://aisel.aisnet.org/amcis2020/accounting_info_systems/accounting_info_systems/8,Ravi Seethamraju,https://sydney.edu.au/business/about/our-people/academic-staff/ravi.seethamraju.html
Deployment of Information Systems for Sustainability Reporting and Performance,2019,Conferences,,https://aisel.aisnet.org/amcis2019/green_is_sustain/green_is_sustain/9/,Ravi Seethamraju,https://sydney.edu.au/business/about/our-people/academic-staff/ravi.seethamraju.html
Digitalization of Small Retail Stores - Challenges in Digital Payments,2019,Conferences,,http://dx.doi.org/10.24251/HICSS.2019.621,Ravi Seethamraju,https://sydney.edu.au/business/about/our-people/academic-staff/ravi.seethamraju.html
"Technology frames, Accountants and ERP systems use",2019,Conferences,,https://aisel.aisnet.org/amcis2019/accounting_info_systems/accounting_info_systems/2/,Ravi Seethamraju,https://sydney.edu.au/business/about/our-people/academic-staff/ravi.seethamraju.html
Adoption of Digital Payments by Small Retail Stores,2018,Conferences,,http://www.acis2018.org/wp-content/uploads/2018/11/ACIS2018_paper_96.pdf,Ravi Seethamraju,https://sydney.edu.au/business/about/our-people/academic-staff/ravi.seethamraju.html
Digitalization of Small Retail Supply Chains in India - Antecedents and Challenges,2017,Conferences,,,Ravi Seethamraju,https://sydney.edu.au/business/about/our-people/academic-staff/ravi.seethamraju.html
"Information Load, Escalation of Commitment and Culture",2017,Conferences,,,Ravi Seethamraju,https://sydney.edu.au/business/about/our-people/academic-staff/ravi.seethamraju.html
Information Systems for Sustainability Reporting - A State of Practice,2016,Conferences,,,Ravi Seethamraju,https://sydney.edu.au/business/about/our-people/academic-staff/ravi.seethamraju.html
Aligning Enterprise Systems with the Organisation - A Sensemaking Perspective,2015,Conferences,,,Ravi Seethamraju,https://sydney.edu.au/business/about/our-people/academic-staff/ravi.seethamraju.html
Barriers to the Adoption of Management Accounting (MA) Processes in Enterprise Resource Planning (ERP) Environments,2015,Conferences,,http://dx.doi.org/10.1109/HICSS.2015.503,Ravi Seethamraju,https://sydney.edu.au/business/about/our-people/academic-staff/ravi.seethamraju.html
Expert Commentary - Optimising the deployment and use of enterprise systems and process management in the higher education sector,2015,Conferences,,,Ravi Seethamraju,https://sydney.edu.au/business/about/our-people/academic-staff/ravi.seethamraju.html
Healthcare Analytics Adoption-Decision Model: A Case Study,2015,Conferences,,https://aisel.aisnet.org/pacis2015/51,Ravi Seethamraju,https://sydney.edu.au/business/about/our-people/academic-staff/ravi.seethamraju.html
Adoption of SaaS Enterprise Systems - A Comparison of Indian and Australian SMEs,2014,Conferences,,http://dx.doi.org/10.1109/ICTER.2014.7083898,Ravi Seethamraju,https://sydney.edu.au/business/about/our-people/academic-staff/ravi.seethamraju.html
Service Process Mapping and Mobile Workflow Solutions in the Monitoring of Tuberculosis (TB) Treatment in Regional India,2014,Conferences,,,Ravi Seethamraju,https://sydney.edu.au/business/about/our-people/academic-staff/ravi.seethamraju.html
Determinants of SaaS ERP Systems Adoption,2013,Conferences,,,Ravi Seethamraju,https://sydney.edu.au/business/about/our-people/academic-staff/ravi.seethamraju.html
"Work Integrated Learning (WIL) Through a Field Project - A Study of Design, Delivery & Challenges",2012,Conferences,,,Ravi Seethamraju,https://sydney.edu.au/business/about/our-people/academic-staff/ravi.seethamraju.html
Design and Evaluation of a Work Integrated Learning (Wil) Initiative in an Accounting Information Systems Course,2011,Conferences,,,Ravi Seethamraju,https://sydney.edu.au/business/about/our-people/academic-staff/ravi.seethamraju.html
Effectiveness of Online Discussion Forum for Case Study Analysis and Assessment,2011,Conferences,,,Ravi Seethamraju,https://sydney.edu.au/business/about/our-people/academic-staff/ravi.seethamraju.html
Enterprise Systems and Demand Chain Management,2011,Conferences,,,Ravi Seethamraju,https://sydney.edu.au/business/about/our-people/academic-staff/ravi.seethamraju.html
Business Process Management- A Missing Link in Business Education,2010,Conferences,,,Ravi Seethamraju,https://sydney.edu.au/business/about/our-people/academic-staff/ravi.seethamraju.html
Demand-Chain Management and Enterprise Systems - A Case Study,2010,Conferences,,,Ravi Seethamraju,https://sydney.edu.au/business/about/our-people/academic-staff/ravi.seethamraju.html
