Title,Year,Type,Journal Name,Article URL,Researcher Name,Profile URL
Ideology diffusion and the role of accounting: A Gramscian approach to understanding China's transition from 1949 to 1957,2014,Journals,Accounting History,http://dx.doi.org/10.1177/1032373214542554,Eagle Zhang,https://sydney.edu.au/business/about/our-people/academic-staff/eagle.zhang.html
Exploring hegemonic change in China: a case of accounting evolution,2013,Journals,Asian Review of Accounting,http://dx.doi.org/10.1108/ARA-04-2012-0016,Eagle Zhang,https://sydney.edu.au/business/about/our-people/academic-staff/eagle.zhang.html
Accounting as an Instrument of Neoliberalisation? Exploring the Adoption of Fair Value Accounting in China,2012,Journals,"Accounting, Auditing and Accountability Journal",http://dx.doi.org/10.1108/09513571211275470,Eagle Zhang,https://sydney.edu.au/business/about/our-people/academic-staff/eagle.zhang.html
Electrical and thermoelectric properties of single-wall carbon nanotube doped Bi2Te3,2012,Journals,Applied Physics Letters,http://dx.doi.org/10.1063/1.4737898,Eagle Zhang,https://sydney.edu.au/business/about/our-people/academic-staff/eagle.zhang.html
Land in China: Re-considering comparability in financial reporting,2010,Journals,Australasian Accounting Business and Finance Journal,,Eagle Zhang,https://sydney.edu.au/business/about/our-people/academic-staff/eagle.zhang.html
The role of accounting intellectuals in the emergence of Chinese accounting standards,2016,Conferences,,,Eagle Zhang,https://sydney.edu.au/business/about/our-people/academic-staff/eagle.zhang.html
Exploring the role of accounting in ideological diffusion from a Gramscian perspective: The case of China from 1958 to 1976,2015,Conferences,,,Eagle Zhang,https://sydney.edu.au/business/about/our-people/academic-staff/eagle.zhang.html
Exploring Hegemonic Change in China: A Case of Accounting Evolution,2012,Conferences,,,Eagle Zhang,https://sydney.edu.au/business/about/our-people/academic-staff/eagle.zhang.html
Exploring the role of accounting in periods of transition: the case of China from 1949 to 1957,2012,Conferences,,,Eagle Zhang,https://sydney.edu.au/business/about/our-people/academic-staff/eagle.zhang.html
Accounting and neoliberalism: a critical reading of IASB/FASBÃ¢â‚¬â„¢s Conceptual Framework for Financial Reporting 2010,2011,Conferences,,,Eagle Zhang,https://sydney.edu.au/business/about/our-people/academic-staff/eagle.zhang.html
Fair Value Accounting in China: Neoliberalisation and Accounting Change,2010,Conferences,,,Eagle Zhang,https://sydney.edu.au/business/about/our-people/academic-staff/eagle.zhang.html
Fair Value Accounting and Chinese Capital Markets,2009,Conferences,,,Eagle Zhang,https://sydney.edu.au/business/about/our-people/academic-staff/eagle.zhang.html
A View of the Process of Accounting Standard Setting in the People's Republic of China,2008,Conferences,,,Eagle Zhang,https://sydney.edu.au/business/about/our-people/academic-staff/eagle.zhang.html
From frustration to fulfilment: Meeting early challenges analysing business transactions,2024,Conferences,,http://dx.doi.org/10.14742/apubs.2024.1045,Mark Waddington,https://sydney.edu.au/business/about/our-people/academic-staff/mark.waddington.html
Mastering Business Transaction Analysis: Utilizing an Excel Learning Aid to Reduce Cognitive Load Through Scaffolded Support and Immediate Feedback,2024,Conferences,,,Mark Waddington,https://sydney.edu.au/business/about/our-people/academic-staff/mark.waddington.html
The Practical Connection,2022,Conferences,,http://dx.doi.org/10.14742/apubs.2022.89,Mark Waddington,https://sydney.edu.au/business/about/our-people/academic-staff/mark.waddington.html
Reimagining First Year Accounting with a Practical Connection,2023,Report,,https://cdrg.blog/2023/01/30/reimagining-first-year-accounting/,Mark Waddington,https://sydney.edu.au/business/about/our-people/academic-staff/mark.waddington.html
"The 2008 UK banking crash: Evidence from option implied volatility. In J. Batten, P. Mackay and N. Wagner (Eds.)",2013,Book Chapters,,http://dx.doi.org/10.1057/9781137025098_9,Simon Tan,https://sydney.edu.au/business/about/our-people/academic-staff/simon.tan.html
Researching the accounting-state-market dynamic in China: A literature review and research agenda,2024,Journals,The British Accounting Review,http://dx.doi.org/10.1016/j.bar.2024.101444,Simon Tan,https://sydney.edu.au/business/about/our-people/academic-staff/simon.tan.html
Ethics Events and Conditions of Possibility: How Sell-Side Financial Analysts Became Involved in Corporate Governance,2021,Journals,Business Ethics Quarterly,http://dx.doi.org/10.1017/beq.2020.11,Simon Tan,https://sydney.edu.au/business/about/our-people/academic-staff/simon.tan.html
"Textual construction of comparative space: How analyst corporate governance reports redefine and create ""best practice""",2018,Journals,"Accounting, Auditing and Accountability Journal",http://dx.doi.org/10.1108/AAAJ-12-2014-1894,Simon Tan,https://sydney.edu.au/business/about/our-people/academic-staff/simon.tan.html
"IPOs, institutional complexity, and management accounting in hybrid organisations: A field study in a state-owned enterprise in China",2017,Journals,Management Accounting Research,http://dx.doi.org/10.1016/j.mar.2016.07.006,Simon Tan,https://sydney.edu.au/business/about/our-people/academic-staff/simon.tan.html
The construction of calculative expertise: The integration of corporate governance into investment analyses by sell-side financial analysts,2014,Journals,"Accounting, Organizations and Society",http://dx.doi.org/10.1016/j.aos.2014.05.003,Simon Tan,https://sydney.edu.au/business/about/our-people/academic-staff/simon.tan.html
The 'others' in corporate governance: The case of the activism of sell-side financial analysts,2008,Journals,Economic Sociology,,Simon Tan,https://sydney.edu.au/business/about/our-people/academic-staff/simon.tan.html
Modes of Constitution: Acting on distances: aesthetic creativity and nurturing of relationality in a small professional service firm,2019,Conferences,,,Simon Tan,https://sydney.edu.au/business/about/our-people/academic-staff/simon.tan.html
"IPOs, Organisational Change, and Management Accounting Change in Listed Chinese State-Owned Enterprises (Research Executive Summary)",2014,Report,,,Simon Tan,https://sydney.edu.au/business/about/our-people/academic-staff/simon.tan.html
"Financial Analysts. In C. L. Cooper, C. Clubb and S. Imam (Eds.)",2015,Reference Works,"Wiley Encyclopedia of Management (3rd edition), Volume 1. Accounting",,Simon Tan,https://sydney.edu.au/business/about/our-people/academic-staff/simon.tan.html
"The Management of Knowledge Resources within Private Organisations: Some European ""Better Practice"" Illustrations. In E OBrien, S Clifford and M Southern (Eds.)",2011,Book Chapters,,http://dx.doi.org/10.4018/978-1-61520-829-6.ch003,Rodney Coyte,https://sydney.edu.au/business/about/our-people/academic-staff/rodney.coyte.html
"Framing strategic resource management. In Baxter, Jane; Poullaos, Chris (Eds.)",2009,Book Chapters,,,Rodney Coyte,https://sydney.edu.au/business/about/our-people/academic-staff/rodney.coyte.html
The effect of mood and information sequence on third party evaluation of escalating capital investment projects,2023,Journals,Management Accounting Research,http://dx.doi.org/10.1016/j.mar.2022.100819,Rodney Coyte,https://sydney.edu.au/business/about/our-people/academic-staff/rodney.coyte.html
The revival of zero-based budgeting: drivers and consequences of firm-level adoptions,2022,Journals,Accounting and Finance,http://dx.doi.org/10.1111/acfi.12884,Rodney Coyte,https://sydney.edu.au/business/about/our-people/academic-staff/rodney.coyte.html
"Enabling Management Control Systems, Situated Learning and Intellectual Capital Development",2019,Journals,"Accounting, Auditing and Accountability Journal",http://dx.doi.org/10.1108/AAAJ-02-2013-1237,Rodney Coyte,https://sydney.edu.au/business/about/our-people/academic-staff/rodney.coyte.html
Is a Fresh Pair of Eyes Always Better? The Effect of Consultant Type and Assigned Task Purpose on Communicating Project Escalation Concerns,2019,Journals,Management Accounting Research,http://dx.doi.org/10.1016/j.mar.2018.09.002,Rodney Coyte,https://sydney.edu.au/business/about/our-people/academic-staff/rodney.coyte.html
The effects of incentive subjectivity and strategy communication on knowledge-sharing and extra-role behaviours,2014,Journals,Management Accounting Research,http://dx.doi.org/10.1016/j.mar.2013.07.003,Rodney Coyte,https://sydney.edu.au/business/about/our-people/academic-staff/rodney.coyte.html
The Impossibility of Philanthropic Funding Decisions: The Australian Non-Government Funder Experience,2013,Journals,Financial Accountability and Management,http://dx.doi.org/10.1111/faam.12020,Rodney Coyte,https://sydney.edu.au/business/about/our-people/academic-staff/rodney.coyte.html
The Management of Knowledge Resources in SMEs: An Australian Case Study,2012,Journals,Journal of Knowledge Management,http://dx.doi.org/10.1108/13673271211262817,Rodney Coyte,https://sydney.edu.au/business/about/our-people/academic-staff/rodney.coyte.html
Engendering Learning Engagement in a Diverse Cohort: A Reflection,2011,Journals,Accounting Research Journal,http://dx.doi.org/10.1108/10309611111163727,Rodney Coyte,https://sydney.edu.au/business/about/our-people/academic-staff/rodney.coyte.html
Examining Management Accounting Change as Rules and Routines: The Effect of Rule Precision,2010,Journals,Australian Accounting Review,http://dx.doi.org/10.1111/j.1835-2561.2010.00083.x,Rodney Coyte,https://sydney.edu.au/business/about/our-people/academic-staff/rodney.coyte.html
Learning for Living: Using Teams for Student Centred Learning,2010,Journals,Synergy,,Rodney Coyte,https://sydney.edu.au/business/about/our-people/academic-staff/rodney.coyte.html
"Technology frames, Accountants and ERP systems use",2019,Conferences,,https://aisel.aisnet.org/amcis2019/accounting_info_systems/accounting_info_systems/2/,Rodney Coyte,https://sydney.edu.au/business/about/our-people/academic-staff/rodney.coyte.html
Examining the Effect of Mood on Third Party Evaluation of Capital Investment Projects,2016,Conferences,,,Rodney Coyte,https://sydney.edu.au/business/about/our-people/academic-staff/rodney.coyte.html
An Internationalisation Pilot to Enhance Educational Outcomes in the Master of Professional Accounting,2010,Conferences,,,Rodney Coyte,https://sydney.edu.au/business/about/our-people/academic-staff/rodney.coyte.html
Exploring Process: Understanding Phenomena Represented as Intellectual Capital,2010,Conferences,,,Rodney Coyte,https://sydney.edu.au/business/about/our-people/academic-staff/rodney.coyte.html
The effect of incentive scheme subjectivity and the communication of the strategic role of human-based intangible asset on knowledge sharing and extra-role behaviours,2010,Conferences,,,Rodney Coyte,https://sydney.edu.au/business/about/our-people/academic-staff/rodney.coyte.html
How management accounting can add value to the merger and acquisition process,2008,Conferences,,,Rodney Coyte,https://sydney.edu.au/business/about/our-people/academic-staff/rodney.coyte.html
Loose coupling or loose interpretations? Management accounting practice as rules and routines re-examined,2008,Conferences,,,Rodney Coyte,https://sydney.edu.au/business/about/our-people/academic-staff/rodney.coyte.html
Loose Coupling or Loose Interpretations? Management Accounting Practice as Rules and Routines Re-Examined,2008,Conferences,,,Rodney Coyte,https://sydney.edu.au/business/about/our-people/academic-staff/rodney.coyte.html
Intangible resource mobilisation: a process perspective,2007,Conferences,,,Rodney Coyte,https://sydney.edu.au/business/about/our-people/academic-staff/rodney.coyte.html
Management accounting control systems and strategy realisation,2007,Conferences,,,Rodney Coyte,https://sydney.edu.au/business/about/our-people/academic-staff/rodney.coyte.html
Strategic change and empowered teams: A micro-analysis of changes in knowing,2006,Conferences,,,Rodney Coyte,https://sydney.edu.au/business/about/our-people/academic-staff/rodney.coyte.html
Above and beyond: How subjective bonus schemes boost extra-role behaviour,2014,Report,,,Rodney Coyte,https://sydney.edu.au/business/about/our-people/academic-staff/rodney.coyte.html
Incentive Scheme Design,2014,Report,,,Rodney Coyte,https://sydney.edu.au/business/about/our-people/academic-staff/rodney.coyte.html
"Business Model Innovation in Franchising: Rethinking the Franchising Taxonomy. In J. Windsperger, G. Cliquer, G. Hendrikse, M. Sreckovic (Eds.)",2019,Book Chapters,,http://dx.doi.org/10.1007/978-3-030-29245-4_4,Cary DiLernia,https://sydney.edu.au/business/about/our-people/academic-staff/cary.dilernia.html
"Contracts: Concepts of Agreement. In Andrew Terry, Des Giugni. (Eds.)",2019,Book Chapters,,,Cary DiLernia,https://sydney.edu.au/business/about/our-people/academic-staff/cary.dilernia.html
"The Modern Corporation. In Andrew Terry, Des Giugni. (Eds.)",2019,Book Chapters,,,Cary DiLernia,https://sydney.edu.au/business/about/our-people/academic-staff/cary.dilernia.html
"Beyond Main Street: Franchising Strategies for Indigenous Entrepreneurship in Australia. In George W. J. Hendrikse, Gerard Cliquet, Thomas Ehrmann, Josef Windsperger (Eds.)",2017,Book Chapters,,http://dx.doi.org/10.1007/978-3-319-57276-5_4,Cary DiLernia,https://sydney.edu.au/business/about/our-people/academic-staff/cary.dilernia.html
"The obligation of good faith and its role in franchise regulation. In Frank Hoy, Rozenn Perrigot, Andrew L. Terry (Eds.)",2017,Book Chapters,,http://dx.doi.org/10.4337/9781785364181.00018,Cary DiLernia,https://sydney.edu.au/business/about/our-people/academic-staff/cary.dilernia.html
"The obligation of good faith and its role in franchise regulation. In Frank Hoy, Rozenn Perrigot, Andrew L. Terry (Eds.)",2017,Book Chapters,,,Cary DiLernia,https://sydney.edu.au/business/about/our-people/academic-staff/cary.dilernia.html
"Contracts: Concepts of agreement. In Andrew Terry, Des Giugni (Eds.)",2016,Book Chapters,,,Cary DiLernia,https://sydney.edu.au/business/about/our-people/academic-staff/cary.dilernia.html
"Quasi-Franchising: A New Model for Strategic Business Cooperation. In Thomas Ehrmann, Josef Windsperger, Gerard Cliquet and George Hendrikse (Eds.)",2013,Book Chapters,,http://dx.doi.org/10.1007/978-3-7908-2867-2_15,Cary DiLernia,https://sydney.edu.au/business/about/our-people/academic-staff/cary.dilernia.html
"Regulating the Franchise Relationship: Franchisor Opportunism, Commercial Morality and Good Faith. In Mika Tuunanen, Josef Windsperger, Gerard Cliquet and George Hendrikse (Eds.)",2011,Book Chapters,,http://dx.doi.org/10.1007/978-3-7908-2615-9_11,Cary DiLernia,https://sydney.edu.au/business/about/our-people/academic-staff/cary.dilernia.html
Continuous Disclosure: The Use of Infringement Notices as an Enforcement Tool. In Juliette Overland (Eds.),2010,Book Chapters,,,Cary DiLernia,https://sydney.edu.au/business/about/our-people/academic-staff/cary.dilernia.html
(Re)imagining purpose: A framework for sustainable nanotechnology innovation,2024,Journals,NanoImpact,http://dx.doi.org/10.1016/j.impact.2024.100511,Cary DiLernia,https://sydney.edu.au/business/about/our-people/academic-staff/cary.dilernia.html
Banking and Climate Risk: A Regulatory Crossroads,2022,Journals,Company and Securities Law Journal,,Cary DiLernia,https://sydney.edu.au/business/about/our-people/academic-staff/cary.dilernia.html
Climate and Carnism: Regulatory Pathways towards a Sustainable Food System,2022,Journals,UNSW Law Journal,https://www.unswlawjournal.unsw.edu.au/wp-content/uploads/2022/10/Issue-453-03-Chen-and-Di-Lerrnia.pdf,Cary DiLernia,https://sydney.edu.au/business/about/our-people/academic-staff/cary.dilernia.html
Growing Pains: The Challenge for Franchising from Increasingly Complex Stakeholder Relationships,2022,Journals,Australian Business Law Review,,Cary DiLernia,https://sydney.edu.au/business/about/our-people/academic-staff/cary.dilernia.html
Climate Risk Disclosure: Tracking the Uptake of the Taskforce on Climate-related Financial Disclosures (TCFD) Recommendations in the Australian Market,2020,Journals,Company and Securities Law Journal,,Cary DiLernia,https://sydney.edu.au/business/about/our-people/academic-staff/cary.dilernia.html
Cyber-related Risk Disclosure in Australia: Evidence from the ASX200,2020,Journals,Company and Securities Law Journal,,Cary DiLernia,https://sydney.edu.au/business/about/our-people/academic-staff/cary.dilernia.html
"Good faith in franchising: The perceptions of franchisees, franchisors and their lawyers in the French context",2019,Journals,International Journal of Retail & Distribution Management,http://dx.doi.org/10.1108/IJRDM-02-2018-0043,Cary DiLernia,https://sydney.edu.au/business/about/our-people/academic-staff/cary.dilernia.html
"Strange Bedfellows? Climate Change, Carbon Risk, and the Regulation of Corporate Disclosure",2018,Journals,Company and Securities Law Journal,,Cary DiLernia,https://sydney.edu.au/business/about/our-people/academic-staff/cary.dilernia.html
Commentary: Empirical Research in Continuous Disclosure,2014,Journals,Australian Accounting Review,http://dx.doi.org/10.1111/auar.12021,Cary DiLernia,https://sydney.edu.au/business/about/our-people/academic-staff/cary.dilernia.html
Odyssey through a forest? Continuous disclosure and the need for practical guidance,2012,Journals,Australian Business Law Review,,Cary DiLernia,https://sydney.edu.au/business/about/our-people/academic-staff/cary.dilernia.html
"Article Review: Carbon Tax: Challenging Neoliberal Solutions to Climate Change by J. Andrew, M.A. Kaidonis and B. Andrew. Critical Perspectives on Accounting, 2010, 21(7), pp. 611Ã¢â‚¬â€œ618",2011,Journals,Social and Environmental Accountability Journal,http://dx.doi.org/10.1080/0969160X.2011.593838,Cary DiLernia,https://sydney.edu.au/business/about/our-people/academic-staff/cary.dilernia.html
Price Queries and the Enforcement of Australia's Continuous Disclosure Regime,2011,Journals,Journal of Applied Research in Accounting and Finance,,Cary DiLernia,https://sydney.edu.au/business/about/our-people/academic-staff/cary.dilernia.html
An Investigation into Questionable Organisational Responses to ASX Price Queries,2010,Journals,Journal of Law and Financial Management,,Cary DiLernia,https://sydney.edu.au/business/about/our-people/academic-staff/cary.dilernia.html
Legal Aspects of Financial Distress,2010,Journals,International Review of Business Research Papers,,Cary DiLernia,https://sydney.edu.au/business/about/our-people/academic-staff/cary.dilernia.html
Shareholder Rights in the Face of Corporate Bankruptcy Events,2010,Journals,Australian Business Law Review,,Cary DiLernia,https://sydney.edu.au/business/about/our-people/academic-staff/cary.dilernia.html
Franchising and the Quest for the Holy Grail: Good Faith or Good Intentions?,2009,Journals,Melbourne University Law Review,,Cary DiLernia,https://sydney.edu.au/business/about/our-people/academic-staff/cary.dilernia.html
Growing pains? Legal and commercial challenges to the business model in franchise system expansion,2018,Conferences,,,Cary DiLernia,https://sydney.edu.au/business/about/our-people/academic-staff/cary.dilernia.html
"The perceptions of franchisees, franchisors and their lawyers in the French context",2018,Conferences,,,Cary DiLernia,https://sydney.edu.au/business/about/our-people/academic-staff/cary.dilernia.html
Business Not as Usual: the Flexible Franchise Model,2016,Conferences,,,Cary DiLernia,https://sydney.edu.au/business/about/our-people/academic-staff/cary.dilernia.html
The Use of Non-Standard Price Queries by the ASX in the Enforcement of Australia's Continuous Disclosure Regime,2015,Conferences,,,Cary DiLernia,https://sydney.edu.au/business/about/our-people/academic-staff/cary.dilernia.html
Back of House Franchising,2011,Conferences,,,Cary DiLernia,https://sydney.edu.au/business/about/our-people/academic-staff/cary.dilernia.html
A History of the Infringement Notice Mechanism and its Use in the Enforcement of Australia's Continuous Disclosure Regime,2010,Conferences,,,Cary DiLernia,https://sydney.edu.au/business/about/our-people/academic-staff/cary.dilernia.html
Good Faith - An Idea Past Its Time,2010,Conferences,,,Cary DiLernia,https://sydney.edu.au/business/about/our-people/academic-staff/cary.dilernia.html
Good Faith in the Context of Franchising Agreements,2010,Conferences,,,Cary DiLernia,https://sydney.edu.au/business/about/our-people/academic-staff/cary.dilernia.html
Money grows on trees,2010,Conferences,,,Cary DiLernia,https://sydney.edu.au/business/about/our-people/academic-staff/cary.dilernia.html
The Subordination of Shareholder Claims Against Companies in Financial Distress,2010,Conferences,,,Cary DiLernia,https://sydney.edu.au/business/about/our-people/academic-staff/cary.dilernia.html
The Use of Infringement Notices in the Enforcement of the Continuous Disclosure Regime - Evidence to 2009,2010,Conferences,,,Cary DiLernia,https://sydney.edu.au/business/about/our-people/academic-staff/cary.dilernia.html
Theoretical and practical considerations concerning the relationship between accounting and its chief unit of account,2010,Conferences,,,Cary DiLernia,https://sydney.edu.au/business/about/our-people/academic-staff/cary.dilernia.html
E-Collaboration within Franchise Networks: opportunities and challenges,2009,Conferences,,,Cary DiLernia,https://sydney.edu.au/business/about/our-people/academic-staff/cary.dilernia.html
Of Money and Accounting,2009,Conferences,,,Cary DiLernia,https://sydney.edu.au/business/about/our-people/academic-staff/cary.dilernia.html
Parity Ranking of Aggrieved Shareholder Claims,2009,Conferences,,,Cary DiLernia,https://sydney.edu.au/business/about/our-people/academic-staff/cary.dilernia.html
The Deep Veins of the Sons of Gwalia Litigation,2009,Conferences,,,Cary DiLernia,https://sydney.edu.au/business/about/our-people/academic-staff/cary.dilernia.html
The Reliance Interest of Creditors,2009,Conferences,,,Cary DiLernia,https://sydney.edu.au/business/about/our-people/academic-staff/cary.dilernia.html
"Accounting, Accountability and Money Ã¢â‚¬â€œ Implications of Georg Simmel's Philosophy of Money for the Social and Environmental Accounting project",2008,Conferences,,,Cary DiLernia,https://sydney.edu.au/business/about/our-people/academic-staff/cary.dilernia.html
Assessing Goodwill Reporting Under a Newly Adopted IFRS Framework,2007,Conferences,,,Cary DiLernia,https://sydney.edu.au/business/about/our-people/academic-staff/cary.dilernia.html
Australia's Continuous Disclosure Regime - Business as Usual or a Cause for Sour Grapes?,2007,Conferences,,,Cary DiLernia,https://sydney.edu.au/business/about/our-people/academic-staff/cary.dilernia.html
Examining the Decision Usefulness of Goodwill Impairment Testing Disclosures Under IFRS,2007,Conferences,,,Cary DiLernia,https://sydney.edu.au/business/about/our-people/academic-staff/cary.dilernia.html
Towards an Understanding of High Magnitude Value Destruction in Acquisition Transactions,2007,Conferences,,,Cary DiLernia,https://sydney.edu.au/business/about/our-people/academic-staff/cary.dilernia.html
What Insights Does Georg Simmel's Philosophy of Money Offer to Contemporary Accounting?,2007,Conferences,,,Cary DiLernia,https://sydney.edu.au/business/about/our-people/academic-staff/cary.dilernia.html
The Social Philosophy of Money: A Critical Reconstruction of Georg Simmel's Philosophie des Geldes,2006,Conferences,,,Cary DiLernia,https://sydney.edu.au/business/about/our-people/academic-staff/cary.dilernia.html
ASIC needs to toughen up,2011,Magazine / Newspaper Articles,,,Cary DiLernia,https://sydney.edu.au/business/about/our-people/academic-staff/cary.dilernia.html
Good faith rejection right for franchising,2009,Magazine / Newspaper Articles,,,Cary DiLernia,https://sydney.edu.au/business/about/our-people/academic-staff/cary.dilernia.html
Franchising Inquiry,2011,Report,,,Cary DiLernia,https://sydney.edu.au/business/about/our-people/academic-staff/cary.dilernia.html
Good Faith in Australian Franchising,2009,Report,,,Cary DiLernia,https://sydney.edu.au/business/about/our-people/academic-staff/cary.dilernia.html
Shareholder Claims Against Insolvent Companies - Implications of the Sons of Gwalia Decision,2008,Report,,,Cary DiLernia,https://sydney.edu.au/business/about/our-people/academic-staff/cary.dilernia.html
Compliance Over Time by Australian Firms with IFRS Disclosure Requirements,2019,Journals,Australian Accounting Review,http://dx.doi.org/10.1111/auar.12267,Jo Wang,https://sydney.edu.au/business/about/our-people/academic-staff/jo.wang.html
Factors Influencing IFRS Disclosure Compliance by Australian Companies,2020,Conferences,,,Jo Wang,https://sydney.edu.au/business/about/our-people/academic-staff/jo.wang.html
Factors Influencing Compliance with IFRS Disclosure Requirements by Australian Listed Companies,2018,Conferences,,,Jo Wang,https://sydney.edu.au/business/about/our-people/academic-staff/jo.wang.html
An Empirical Investigation into Compliance over Time by Australian Firms with IFRS Disclosure Requirements,2017,Conferences,,,Jo Wang,https://sydney.edu.au/business/about/our-people/academic-staff/jo.wang.html
An Empirical Investigation into Compliance over Time by Australian Firms with IFRS Disclosure Requirements,2017,Conferences,,,Jo Wang,https://sydney.edu.au/business/about/our-people/academic-staff/jo.wang.html
Fabricating an S&OP process: circulating references and matters of concern,2013,Books,,,Reaven Yu,https://sydney.edu.au/business/about/our-people/academic-staff/lichen.yu.html
